{
  "$schema": "https://json-schema.org/draft/2020-12/schema",
  "$id": "https://github.com/rajib2k5/implied-vol-forecasting/schemas/app-data/envelope.schema.json",
  "title": "ivf app-data envelope",
  "description": "Common wrapper of every JSON file the app reads (ADR 0001 D1). File schemas $ref this and narrow `dataset` and `payload`. Shared definitions live in $defs. Dates and times are constrained by `pattern`, not `format`: `format` is annotation-only in 2020-12 and Ajv strict mode rejects it without the ajv-formats plugin. Patterns use [0-9] because Python's \\d also matches non-ASCII digits. Every pattern ends in $(?!\\n) because Python's re lets $ match before a final newline and ECMA-262 does not; with the guard both engines agree (amended M0).",
  "type": "object",
  "additionalProperties": false,
  "required": ["schema_version", "generated_at", "source_commit", "source_dirty", "data_mode", "dataset", "payload"],
  "properties": {
    "schema_version": {
      "description": "Semver of the whole contract. Major is pinned to 1 here, so a MAJOR bump means editing this pattern deliberately.",
      "type": "string",
      "pattern": "^1\\.(0|[1-9][0-9]*)\\.(0|[1-9][0-9]*)$(?!\\n)"
    },
    "generated_at": {
      "description": "Export time, RFC 3339 in UTC.",
      "type": "string",
      "pattern": "^[0-9]{4}-[0-9]{2}-[0-9]{2}T[0-9]{2}:[0-9]{2}:[0-9]{2}(\\.[0-9]+)?Z$(?!\\n)"
    },
    "source_commit": {
      "description": "git rev-parse HEAD of the producing code.",
      "$ref": "#/$defs/hex40"
    },
    "source_dirty": {
      "description": "True if the working tree had uncommitted changes at export.",
      "type": "boolean"
    },
    "data_mode": {
      "description": "Closed enum: adding a value is a MAJOR bump.",
      "enum": ["synthetic", "real"]
    },
    "dataset": {
      "description": "File identity; each file schema narrows it with const.",
      "$ref": "#/$defs/id"
    },
    "payload": {
      "type": "object"
    }
  },
  "$defs": {
    "id": {
      "type": "string",
      "pattern": "^[a-z][a-z0-9_]*$(?!\\n)"
    },
    "nullableId": {
      "type": ["string", "null"],
      "pattern": "^[a-z][a-z0-9_]*$(?!\\n)"
    },
    "hex40": {
      "type": "string",
      "pattern": "^[0-9a-f]{40}$(?!\\n)"
    },
    "hex64": {
      "type": "string",
      "pattern": "^[0-9a-f]{64}$(?!\\n)"
    },
    "isoDate": {
      "description": "Session date YYYY-MM-DD (exchange-local, no time zone).",
      "type": "string",
      "pattern": "^[0-9]{4}-(0[1-9]|1[0-2])-(0[1-9]|[12][0-9]|3[01])$(?!\\n)"
    },
    "isoDateArray": {
      "type": "array",
      "minItems": 1,
      "items": { "$ref": "#/$defs/isoDate" }
    },
    "period": {
      "description": "Closed enum: dev = origin < holdout_start, holdout = origin >= holdout_start.",
      "enum": ["dev", "holdout"]
    },
    "index": {
      "description": "0-based index into an axis array of the same file.",
      "type": "integer",
      "minimum": 0
    },
    "horizon": {
      "description": "Forecast horizon in trading sessions.",
      "type": "integer",
      "minimum": 1
    },
    "nullableNumber": {
      "type": ["number", "null"]
    },
    "nullablePositive": {
      "description": "Vol-point level or forecast; must be > 0 when present (QLIKE needs positive values).",
      "type": ["number", "null"],
      "exclusiveMinimum": 0
    },
    "nullableNonNegative": {
      "type": ["number", "null"],
      "minimum": 0
    },
    "nullableProbability": {
      "type": ["number", "null"],
      "minimum": 0,
      "maximum": 1
    },
    "nullableNumberArray": {
      "type": "array",
      "items": { "$ref": "#/$defs/nullableNumber" }
    },
    "nullablePositiveArray": {
      "type": "array",
      "items": { "$ref": "#/$defs/nullablePositive" }
    }
  }
}
