{"data_mode":"synthetic","dataset":"eda","generated_at":"2026-10-30T01:57:25Z","payload":{"acf":[{"acf":[-0.009,0.0003,0.0193,-0.0156,-0.0019,-0.0071,0.0073,0.0177,0.0018,0.0056,-0.0017,0.0127,0.0061,-0.0198,-0.0117,-0.0092,0.0037,0.0034,0.0041,0.007,-0.0093],"band95":0.021,"label":"S&P 500 log return r","ljung_box_p_last":0.605,"n":8688,"series_id":"r"},{"acf":[0.1519,0.1695,0.1473,0.1241,0.1391,0.1443,0.1322,0.1316,0.123,0.1328,0.1121,0.1072,0.1034,0.1172,0.1224,0.1231,0.1035,0.1021,0.1107,0.0757,0.0995],"band95":0.021,"label":"absolute return |r|","ljung_box_p_last":0.0,"n":8688,"series_id":"abs_r"},{"acf":[0.1736,0.1886,0.1859,0.1448,0.1719,0.1683,0.1567,0.1395,0.1286,0.1671,0.1155,0.1189,0.1434,0.1356,0.1395,0.1334,0.1406,0.1111,0.1183,0.1049,0.0979],"band95":0.021,"label":"squared return r\u00b2","ljung_box_p_last":0.0,"n":8688,"series_id":"r2"},{"acf":[0.9813,0.9633,0.9452,0.9278,0.9114,0.8954,0.8801,0.8655,0.8509,0.8361,0.822,0.8081,0.7947,0.7812,0.7675,0.7537,0.7401,0.7267,0.7131,0.6996,0.6863],"band95":0.021,"label":"ln VIX","ljung_box_p_last":null,"n":8689,"series_id":"log_vix"}],"first":"1990-01-02","half_life":[{"half_life_ci95":[30.16,47.14],"half_life_sessions":36.8,"n":8688,"phi":0.9813,"phi_ci95":[0.9773,0.9854],"sample":"pre_holdout"},{"half_life_ci95":[27.58,66.89],"half_life_sessions":39.12,"n":2577,"phi":0.9824,"phi_ci95":[0.9752,0.9897],"sample":"burn_in"},{"half_life_ci95":[28.42,48.17],"half_life_sessions":35.77,"n":6110,"phi":0.9808,"phi_ci95":[0.9759,0.9857],"sample":"dev"}],"holdout_start":"2024-07-01","last":"2024-06-28","nlags":21,"period":"pre_holdout","source_run_id":"beb513536bef"},"schema_version":"1.1.0","source_commit":"f903a01d62ba12b8978a6454fbcacad191e742c6","source_dirty":false}
